
*** Running vivado
    with args -log Top_Student.vdi -applog -m64 -product Vivado -messageDb vivado.pb -mode batch -source Top_Student.tcl -notrace


****** Vivado v2018.2 (64-bit)
  **** SW Build 2258646 on Thu Jun 14 20:03:12 MDT 2018
  **** IP Build 2256618 on Thu Jun 14 22:10:49 MDT 2018
    ** Copyright 1986-2018 Xilinx, Inc. All Rights Reserved.

source Top_Student.tcl -notrace
Command: link_design -top Top_Student -part xc7a35tcpg236-1
Design is defaulting to srcset: sources_1
Design is defaulting to constrset: constrs_1
INFO: [Netlist 29-17] Analyzing 270 Unisim elements for replacement
INFO: [Netlist 29-28] Unisim Transformation completed in 0 CPU seconds
INFO: [Project 1-479] Netlist was created with Vivado 2018.2
INFO: [Device 21-403] Loading part xc7a35tcpg236-1
INFO: [Project 1-570] Preparing netlist for logic optimization
Parsing XDC File [C:/Users/teode/OneDrive/Documents/NUS Modules/Y2S2 Modules/EE2026/EE2026Project/Tank_Game/MODS.srcs/constrs_1/new/basys_3.xdc]
Finished Parsing XDC File [C:/Users/teode/OneDrive/Documents/NUS Modules/Y2S2 Modules/EE2026/EE2026Project/Tank_Game/MODS.srcs/constrs_1/new/basys_3.xdc]
INFO: [Opt 31-138] Pushed 0 inverter(s) to 0 load pin(s).
INFO: [Project 1-111] Unisim Transformation Summary:
No Unisim elements were transformed.

7 Infos, 0 Warnings, 0 Critical Warnings and 0 Errors encountered.
link_design completed successfully
link_design: Time (s): cpu = 00:00:03 ; elapsed = 00:00:09 . Memory (MB): peak = 572.430 ; gain = 323.160
Command: opt_design
Attempting to get a license for feature 'Implementation' and/or device 'xc7a35t'
INFO: [Common 17-349] Got license for feature 'Implementation' and/or device 'xc7a35t'
Running DRC as a precondition to command opt_design

Starting DRC Task
INFO: [DRC 23-27] Running DRC with 2 threads
INFO: [Project 1-461] DRC finished with 0 Errors
INFO: [Project 1-462] Please refer to the DRC report (report_drc) for more information.

Time (s): cpu = 00:00:00 ; elapsed = 00:00:00.733 . Memory (MB): peak = 582.992 ; gain = 10.562

Starting Cache Timing Information Task
INFO: [Timing 38-35] Done setting XDC timing constraints.
Ending Cache Timing Information Task | Checksum: 21ecfe339

Time (s): cpu = 00:00:05 ; elapsed = 00:00:15 . Memory (MB): peak = 1139.395 ; gain = 556.402

Starting Logic Optimization Task

Phase 1 Retarget
INFO: [Opt 31-138] Pushed 1 inverter(s) to 20 load pin(s).
INFO: [Opt 31-49] Retargeted 0 cell(s).
Phase 1 Retarget | Checksum: 16c609fb9

Time (s): cpu = 00:00:00 ; elapsed = 00:00:00.406 . Memory (MB): peak = 1139.395 ; gain = 0.000
INFO: [Opt 31-389] Phase Retarget created 0 cells and removed 0 cells

Phase 2 Constant propagation
INFO: [Opt 31-138] Pushed 0 inverter(s) to 0 load pin(s).
Phase 2 Constant propagation | Checksum: 10a2d5831

Time (s): cpu = 00:00:00 ; elapsed = 00:00:00.567 . Memory (MB): peak = 1139.395 ; gain = 0.000
INFO: [Opt 31-389] Phase Constant propagation created 0 cells and removed 0 cells

Phase 3 Sweep
Phase 3 Sweep | Checksum: 14fe8778e

Time (s): cpu = 00:00:00 ; elapsed = 00:00:00.810 . Memory (MB): peak = 1139.395 ; gain = 0.000
INFO: [Opt 31-389] Phase Sweep created 0 cells and removed 0 cells

Phase 4 BUFG optimization
Phase 4 BUFG optimization | Checksum: 14fe8778e

Time (s): cpu = 00:00:00 ; elapsed = 00:00:01 . Memory (MB): peak = 1139.395 ; gain = 0.000
INFO: [Opt 31-662] Phase BUFG optimization created 0 cells of which 0 are BUFGs and removed 0 cells.

Phase 5 Shift Register Optimization
Phase 5 Shift Register Optimization | Checksum: 17279f98a

Time (s): cpu = 00:00:00 ; elapsed = 00:00:01 . Memory (MB): peak = 1139.395 ; gain = 0.000
INFO: [Opt 31-389] Phase Shift Register Optimization created 0 cells and removed 0 cells

Phase 6 Post Processing Netlist
Phase 6 Post Processing Netlist | Checksum: 17279f98a

Time (s): cpu = 00:00:00 ; elapsed = 00:00:01 . Memory (MB): peak = 1139.395 ; gain = 0.000
INFO: [Opt 31-389] Phase Post Processing Netlist created 0 cells and removed 0 cells

Starting Connectivity Check Task

Time (s): cpu = 00:00:00 ; elapsed = 00:00:00.016 . Memory (MB): peak = 1139.395 ; gain = 0.000
Ending Logic Optimization Task | Checksum: 17279f98a

Time (s): cpu = 00:00:00 ; elapsed = 00:00:02 . Memory (MB): peak = 1139.395 ; gain = 0.000

Starting Power Optimization Task
INFO: [Pwropt 34-132] Skipping clock gating for clocks with a period < 2.00 ns.
Ending Power Optimization Task | Checksum: 17279f98a

Time (s): cpu = 00:00:00 ; elapsed = 00:00:00.031 . Memory (MB): peak = 1139.395 ; gain = 0.000

Starting Final Cleanup Task
Ending Final Cleanup Task | Checksum: 17279f98a

Time (s): cpu = 00:00:00 ; elapsed = 00:00:00 . Memory (MB): peak = 1139.395 ; gain = 0.000
INFO: [Common 17-83] Releasing license: Implementation
23 Infos, 0 Warnings, 0 Critical Warnings and 0 Errors encountered.
opt_design completed successfully
opt_design: Time (s): cpu = 00:00:05 ; elapsed = 00:00:18 . Memory (MB): peak = 1139.395 ; gain = 566.965
INFO: [Timing 38-480] Writing timing data to binary archive.
Writing placer database...
Writing XDEF routing.
Writing XDEF routing logical nets.
Writing XDEF routing special nets.
Write XDEF Complete: Time (s): cpu = 00:00:01 ; elapsed = 00:00:00.126 . Memory (MB): peak = 1139.395 ; gain = 0.000
INFO: [Common 17-1381] The checkpoint 'C:/Users/teode/OneDrive/Documents/NUS Modules/Y2S2 Modules/EE2026/EE2026Project/Tank_Game/MODS.runs/impl_1/Top_Student_opt.dcp' has been generated.
INFO: [runtcl-4] Executing : report_drc -file Top_Student_drc_opted.rpt -pb Top_Student_drc_opted.pb -rpx Top_Student_drc_opted.rpx
Command: report_drc -file Top_Student_drc_opted.rpt -pb Top_Student_drc_opted.pb -rpx Top_Student_drc_opted.rpx
INFO: [IP_Flow 19-234] Refreshing IP repositories
INFO: [IP_Flow 19-1704] No user IP repositories specified
INFO: [IP_Flow 19-2313] Loaded Vivado IP repository 'C:/Xilinx/Vivado/2018.2/data/ip'.
INFO: [DRC 23-27] Running DRC with 2 threads
INFO: [Coretcl 2-168] The results of DRC are in file C:/Users/teode/OneDrive/Documents/NUS Modules/Y2S2 Modules/EE2026/EE2026Project/Tank_Game/MODS.runs/impl_1/Top_Student_drc_opted.rpt.
report_drc completed successfully
report_drc: Time (s): cpu = 00:00:03 ; elapsed = 00:00:07 . Memory (MB): peak = 1139.395 ; gain = 0.000
Command: place_design
Attempting to get a license for feature 'Implementation' and/or device 'xc7a35t'
INFO: [Common 17-349] Got license for feature 'Implementation' and/or device 'xc7a35t'
INFO: [DRC 23-27] Running DRC with 2 threads
INFO: [Vivado_Tcl 4-198] DRC finished with 0 Errors
INFO: [Vivado_Tcl 4-199] Please refer to the DRC report (report_drc) for more information.
Running DRC as a precondition to command place_design
INFO: [DRC 23-27] Running DRC with 2 threads
INFO: [Vivado_Tcl 4-198] DRC finished with 0 Errors
INFO: [Vivado_Tcl 4-199] Please refer to the DRC report (report_drc) for more information.

Starting Placer Task
INFO: [Place 30-611] Multithreading enabled for place_design using a maximum of 2 CPUs

Phase 1 Placer Initialization

Phase 1.1 Placer Initialization Netlist Sorting
Netlist sorting complete. Time (s): cpu = 00:00:00 ; elapsed = 00:00:00.006 . Memory (MB): peak = 1139.395 ; gain = 0.000
Phase 1.1 Placer Initialization Netlist Sorting | Checksum: 159377d87

Time (s): cpu = 00:00:00 ; elapsed = 00:00:00.018 . Memory (MB): peak = 1139.395 ; gain = 0.000
Netlist sorting complete. Time (s): cpu = 00:00:00 ; elapsed = 00:00:00.005 . Memory (MB): peak = 1139.395 ; gain = 0.000

Phase 1.2 IO Placement/ Clock Placement/ Build Placer Device
INFO: [Timing 38-35] Done setting XDC timing constraints.
Phase 1.2 IO Placement/ Clock Placement/ Build Placer Device | Checksum: d4f0fa2c

Time (s): cpu = 00:00:02 ; elapsed = 00:00:05 . Memory (MB): peak = 1143.277 ; gain = 3.883

Phase 1.3 Build Placer Netlist Model
Phase 1.3 Build Placer Netlist Model | Checksum: 188aba26e

Time (s): cpu = 00:00:03 ; elapsed = 00:00:06 . Memory (MB): peak = 1144.434 ; gain = 5.039

Phase 1.4 Constrain Clocks/Macros
Phase 1.4 Constrain Clocks/Macros | Checksum: 188aba26e

Time (s): cpu = 00:00:03 ; elapsed = 00:00:06 . Memory (MB): peak = 1144.434 ; gain = 5.039
Phase 1 Placer Initialization | Checksum: 188aba26e

Time (s): cpu = 00:00:03 ; elapsed = 00:00:06 . Memory (MB): peak = 1144.434 ; gain = 5.039

Phase 2 Global Placement

Phase 2.1 Floorplanning
Phase 2.1 Floorplanning | Checksum: 113d68e66

Time (s): cpu = 00:00:03 ; elapsed = 00:00:06 . Memory (MB): peak = 1144.434 ; gain = 5.039

Phase 2.2 Physical Synthesis In Placer
INFO: [Physopt 32-65] No nets found for high-fanout optimization.
INFO: [Physopt 32-232] Optimized 0 net. Created 0 new instance.
INFO: [Physopt 32-775] End 1 Pass. Optimized 0 net or cell. Created 0 new cell, deleted 0 existing cell and moved 0 existing cell
Netlist sorting complete. Time (s): cpu = 00:00:00 ; elapsed = 00:00:00.006 . Memory (MB): peak = 1144.434 ; gain = 0.000

Summary of Physical Synthesis Optimizations
============================================


-----------------------------------------------------------------------------------------------------------------------------
|  Optimization       |  Added Cells  |  Removed Cells  |  Optimized Cells/Nets  |  Dont Touch  |  Iterations  |  Elapsed   |
-----------------------------------------------------------------------------------------------------------------------------
|  Very High Fanout   |            0  |              0  |                     0  |           0  |           1  |  00:00:00  |
|  Total              |            0  |              0  |                     0  |           0  |           1  |  00:00:00  |
-----------------------------------------------------------------------------------------------------------------------------


Phase 2.2 Physical Synthesis In Placer | Checksum: 1d04f3aa7

Time (s): cpu = 00:00:06 ; elapsed = 00:00:11 . Memory (MB): peak = 1144.434 ; gain = 5.039
Phase 2 Global Placement | Checksum: 1c8b7773b

Time (s): cpu = 00:00:06 ; elapsed = 00:00:11 . Memory (MB): peak = 1144.434 ; gain = 5.039

Phase 3 Detail Placement

Phase 3.1 Commit Multi Column Macros
Phase 3.1 Commit Multi Column Macros | Checksum: 1c8b7773b

Time (s): cpu = 00:00:06 ; elapsed = 00:00:11 . Memory (MB): peak = 1144.434 ; gain = 5.039

Phase 3.2 Commit Most Macros & LUTRAMs
Phase 3.2 Commit Most Macros & LUTRAMs | Checksum: 19b3f66ef

Time (s): cpu = 00:00:06 ; elapsed = 00:00:12 . Memory (MB): peak = 1144.434 ; gain = 5.039

Phase 3.3 Area Swap Optimization
Phase 3.3 Area Swap Optimization | Checksum: 1d2b6d9bf

Time (s): cpu = 00:00:06 ; elapsed = 00:00:12 . Memory (MB): peak = 1144.434 ; gain = 5.039

Phase 3.4 Pipeline Register Optimization
Phase 3.4 Pipeline Register Optimization | Checksum: 1d2b6d9bf

Time (s): cpu = 00:00:06 ; elapsed = 00:00:12 . Memory (MB): peak = 1144.434 ; gain = 5.039

Phase 3.5 Small Shape Detail Placement
Phase 3.5 Small Shape Detail Placement | Checksum: 143916d98

Time (s): cpu = 00:00:06 ; elapsed = 00:00:13 . Memory (MB): peak = 1144.434 ; gain = 5.039

Phase 3.6 Re-assign LUT pins
Phase 3.6 Re-assign LUT pins | Checksum: cc2fd339

Time (s): cpu = 00:00:06 ; elapsed = 00:00:13 . Memory (MB): peak = 1144.434 ; gain = 5.039

Phase 3.7 Pipeline Register Optimization
Phase 3.7 Pipeline Register Optimization | Checksum: cc2fd339

Time (s): cpu = 00:00:06 ; elapsed = 00:00:13 . Memory (MB): peak = 1144.434 ; gain = 5.039
Phase 3 Detail Placement | Checksum: cc2fd339

Time (s): cpu = 00:00:06 ; elapsed = 00:00:13 . Memory (MB): peak = 1144.434 ; gain = 5.039

Phase 4 Post Placement Optimization and Clean-Up

Phase 4.1 Post Commit Optimization
INFO: [Timing 38-35] Done setting XDC timing constraints.

Phase 4.1.1 Post Placement Optimization
Post Placement Optimization Initialization | Checksum: 1d6a29c17

Phase 4.1.1.1 BUFG Insertion
INFO: [Place 46-31] BUFG insertion identified 0 candidate nets, 0 success, 0 skipped for placement/routing, 0 skipped for timing, 0 skipped for netlist change reason.
Phase 4.1.1.1 BUFG Insertion | Checksum: 1d6a29c17

Time (s): cpu = 00:00:07 ; elapsed = 00:00:14 . Memory (MB): peak = 1172.848 ; gain = 33.453
INFO: [Place 30-746] Post Placement Timing Summary WNS=5.556. For the most accurate timing information please run report_timing.
Phase 4.1.1 Post Placement Optimization | Checksum: 13c04d3ca

Time (s): cpu = 00:00:07 ; elapsed = 00:00:14 . Memory (MB): peak = 1172.848 ; gain = 33.453
Phase 4.1 Post Commit Optimization | Checksum: 13c04d3ca

Time (s): cpu = 00:00:07 ; elapsed = 00:00:14 . Memory (MB): peak = 1172.848 ; gain = 33.453

Phase 4.2 Post Placement Cleanup
Phase 4.2 Post Placement Cleanup | Checksum: 13c04d3ca

Time (s): cpu = 00:00:07 ; elapsed = 00:00:14 . Memory (MB): peak = 1172.848 ; gain = 33.453

Phase 4.3 Placer Reporting
Phase 4.3 Placer Reporting | Checksum: 13c04d3ca

Time (s): cpu = 00:00:07 ; elapsed = 00:00:14 . Memory (MB): peak = 1172.848 ; gain = 33.453

Phase 4.4 Final Placement Cleanup
Phase 4.4 Final Placement Cleanup | Checksum: 14c73bd12

Time (s): cpu = 00:00:07 ; elapsed = 00:00:14 . Memory (MB): peak = 1172.848 ; gain = 33.453
Phase 4 Post Placement Optimization and Clean-Up | Checksum: 14c73bd12

Time (s): cpu = 00:00:07 ; elapsed = 00:00:14 . Memory (MB): peak = 1172.848 ; gain = 33.453
Ending Placer Task | Checksum: 12cc40552

Time (s): cpu = 00:00:07 ; elapsed = 00:00:14 . Memory (MB): peak = 1172.848 ; gain = 33.453
INFO: [Common 17-83] Releasing license: Implementation
47 Infos, 0 Warnings, 0 Critical Warnings and 0 Errors encountered.
place_design completed successfully
place_design: Time (s): cpu = 00:00:08 ; elapsed = 00:00:17 . Memory (MB): peak = 1172.848 ; gain = 33.453
INFO: [Timing 38-480] Writing timing data to binary archive.
Writing placer database...
Writing XDEF routing.
Writing XDEF routing logical nets.
Writing XDEF routing special nets.
Write XDEF Complete: Time (s): cpu = 00:00:00 ; elapsed = 00:00:00.690 . Memory (MB): peak = 1180.453 ; gain = 7.605
INFO: [Common 17-1381] The checkpoint 'C:/Users/teode/OneDrive/Documents/NUS Modules/Y2S2 Modules/EE2026/EE2026Project/Tank_Game/MODS.runs/impl_1/Top_Student_placed.dcp' has been generated.
INFO: [runtcl-4] Executing : report_io -file Top_Student_io_placed.rpt
report_io: Time (s): cpu = 00:00:00 ; elapsed = 00:00:00.174 . Memory (MB): peak = 1180.453 ; gain = 0.000
INFO: [runtcl-4] Executing : report_utilization -file Top_Student_utilization_placed.rpt -pb Top_Student_utilization_placed.pb
report_utilization: Time (s): cpu = 00:00:00 ; elapsed = 00:00:00.098 . Memory (MB): peak = 1180.453 ; gain = 0.000
INFO: [runtcl-4] Executing : report_control_sets -verbose -file Top_Student_control_sets_placed.rpt
report_control_sets: Time (s): cpu = 00:00:00 ; elapsed = 00:00:00.013 . Memory (MB): peak = 1180.453 ; gain = 0.000
Command: route_design
Attempting to get a license for feature 'Implementation' and/or device 'xc7a35t'
INFO: [Common 17-349] Got license for feature 'Implementation' and/or device 'xc7a35t'
Running DRC as a precondition to command route_design
INFO: [DRC 23-27] Running DRC with 2 threads
INFO: [Vivado_Tcl 4-198] DRC finished with 0 Errors
INFO: [Vivado_Tcl 4-199] Please refer to the DRC report (report_drc) for more information.


Starting Routing Task
INFO: [Route 35-254] Multithreading enabled for route_design using a maximum of 2 CPUs
Checksum: PlaceDB: 68320248 ConstDB: 0 ShapeSum: c492030a RouteDB: 0

Phase 1 Build RT Design
Phase 1 Build RT Design | Checksum: d57a0c7e

Time (s): cpu = 00:00:19 ; elapsed = 00:00:55 . Memory (MB): peak = 1275.969 ; gain = 95.516
Post Restoration Checksum: NetGraph: a891698c NumContArr: 2ce8a2f2 Constraints: 0 Timing: 0

Phase 2 Router Initialization

Phase 2.1 Create Timer
Phase 2.1 Create Timer | Checksum: d57a0c7e

Time (s): cpu = 00:00:19 ; elapsed = 00:00:55 . Memory (MB): peak = 1275.969 ; gain = 95.516

Phase 2.2 Fix Topology Constraints
Phase 2.2 Fix Topology Constraints | Checksum: d57a0c7e

Time (s): cpu = 00:00:19 ; elapsed = 00:00:55 . Memory (MB): peak = 1281.969 ; gain = 101.516

Phase 2.3 Pre Route Cleanup
Phase 2.3 Pre Route Cleanup | Checksum: d57a0c7e

Time (s): cpu = 00:00:19 ; elapsed = 00:00:55 . Memory (MB): peak = 1281.969 ; gain = 101.516
 Number of Nodes with overlaps = 0

Phase 2.4 Update Timing
Phase 2.4 Update Timing | Checksum: 11cc4f3ea

Time (s): cpu = 00:00:20 ; elapsed = 00:00:56 . Memory (MB): peak = 1288.652 ; gain = 108.199
INFO: [Route 35-416] Intermediate Timing Summary | WNS=5.653  | TNS=0.000  | WHS=-0.040 | THS=-0.477 |

Phase 2 Router Initialization | Checksum: 119e8b217

Time (s): cpu = 00:00:20 ; elapsed = 00:00:57 . Memory (MB): peak = 1288.652 ; gain = 108.199

Phase 3 Initial Routing
Phase 3 Initial Routing | Checksum: 1bc5670a8

Time (s): cpu = 00:00:21 ; elapsed = 00:00:57 . Memory (MB): peak = 1288.652 ; gain = 108.199

Phase 4 Rip-up And Reroute

Phase 4.1 Global Iteration 0
 Number of Nodes with overlaps = 276
 Number of Nodes with overlaps = 1
 Number of Nodes with overlaps = 0
INFO: [Route 35-416] Intermediate Timing Summary | WNS=5.238  | TNS=0.000  | WHS=N/A    | THS=N/A    |

Phase 4.1 Global Iteration 0 | Checksum: acbfbf7b

Time (s): cpu = 00:00:21 ; elapsed = 00:00:58 . Memory (MB): peak = 1288.652 ; gain = 108.199
Phase 4 Rip-up And Reroute | Checksum: acbfbf7b

Time (s): cpu = 00:00:21 ; elapsed = 00:00:59 . Memory (MB): peak = 1288.652 ; gain = 108.199

Phase 5 Delay and Skew Optimization

Phase 5.1 Delay CleanUp
Phase 5.1 Delay CleanUp | Checksum: acbfbf7b

Time (s): cpu = 00:00:21 ; elapsed = 00:00:59 . Memory (MB): peak = 1288.652 ; gain = 108.199

Phase 5.2 Clock Skew Optimization
Phase 5.2 Clock Skew Optimization | Checksum: acbfbf7b

Time (s): cpu = 00:00:21 ; elapsed = 00:00:59 . Memory (MB): peak = 1288.652 ; gain = 108.199
Phase 5 Delay and Skew Optimization | Checksum: acbfbf7b

Time (s): cpu = 00:00:21 ; elapsed = 00:00:59 . Memory (MB): peak = 1288.652 ; gain = 108.199

Phase 6 Post Hold Fix

Phase 6.1 Hold Fix Iter

Phase 6.1.1 Update Timing
Phase 6.1.1 Update Timing | Checksum: 109c24c72

Time (s): cpu = 00:00:21 ; elapsed = 00:00:59 . Memory (MB): peak = 1288.652 ; gain = 108.199
INFO: [Route 35-416] Intermediate Timing Summary | WNS=5.238  | TNS=0.000  | WHS=0.108  | THS=0.000  |

Phase 6.1 Hold Fix Iter | Checksum: 109c24c72

Time (s): cpu = 00:00:21 ; elapsed = 00:00:59 . Memory (MB): peak = 1288.652 ; gain = 108.199
Phase 6 Post Hold Fix | Checksum: 109c24c72

Time (s): cpu = 00:00:21 ; elapsed = 00:00:59 . Memory (MB): peak = 1288.652 ; gain = 108.199

Phase 7 Route finalize

Router Utilization Summary
  Global Vertical Routing Utilization    = 0.332935 %
  Global Horizontal Routing Utilization  = 0.335502 %
  Routable Net Status*
  *Does not include unroutable nets such as driverless and loadless.
  Run report_route_status for detailed report.
  Number of Failed Nets               = 0
  Number of Unrouted Nets             = 0
  Number of Partially Routed Nets     = 0
  Number of Node Overlaps             = 0

Phase 7 Route finalize | Checksum: 109c24c72

Time (s): cpu = 00:00:22 ; elapsed = 00:00:59 . Memory (MB): peak = 1288.652 ; gain = 108.199

Phase 8 Verifying routed nets

 Verification completed successfully
Phase 8 Verifying routed nets | Checksum: 109c24c72

Time (s): cpu = 00:00:22 ; elapsed = 00:00:59 . Memory (MB): peak = 1289.211 ; gain = 108.758

Phase 9 Depositing Routes
Phase 9 Depositing Routes | Checksum: 1a5253396

Time (s): cpu = 00:00:22 ; elapsed = 00:00:59 . Memory (MB): peak = 1289.211 ; gain = 108.758

Phase 10 Post Router Timing
INFO: [Route 35-57] Estimated Timing Summary | WNS=5.238  | TNS=0.000  | WHS=0.108  | THS=0.000  |

INFO: [Route 35-327] The final timing numbers are based on the router estimated timing analysis. For a complete and accurate timing signoff, please run report_timing_summary.
Phase 10 Post Router Timing | Checksum: 1a5253396

Time (s): cpu = 00:00:22 ; elapsed = 00:00:59 . Memory (MB): peak = 1289.211 ; gain = 108.758
INFO: [Route 35-16] Router Completed Successfully

Time (s): cpu = 00:00:22 ; elapsed = 00:00:59 . Memory (MB): peak = 1289.211 ; gain = 108.758

Routing Is Done.
INFO: [Common 17-83] Releasing license: Implementation
64 Infos, 0 Warnings, 0 Critical Warnings and 0 Errors encountered.
route_design completed successfully
route_design: Time (s): cpu = 00:00:23 ; elapsed = 00:01:02 . Memory (MB): peak = 1289.211 ; gain = 108.758
INFO: [Timing 38-480] Writing timing data to binary archive.
Writing placer database...
Writing XDEF routing.
Writing XDEF routing logical nets.
Writing XDEF routing special nets.
Write XDEF Complete: Time (s): cpu = 00:00:01 ; elapsed = 00:00:00.861 . Memory (MB): peak = 1294.488 ; gain = 5.277
INFO: [Common 17-1381] The checkpoint 'C:/Users/teode/OneDrive/Documents/NUS Modules/Y2S2 Modules/EE2026/EE2026Project/Tank_Game/MODS.runs/impl_1/Top_Student_routed.dcp' has been generated.
INFO: [runtcl-4] Executing : report_drc -file Top_Student_drc_routed.rpt -pb Top_Student_drc_routed.pb -rpx Top_Student_drc_routed.rpx
Command: report_drc -file Top_Student_drc_routed.rpt -pb Top_Student_drc_routed.pb -rpx Top_Student_drc_routed.rpx
INFO: [DRC 23-27] Running DRC with 2 threads
INFO: [Coretcl 2-168] The results of DRC are in file C:/Users/teode/OneDrive/Documents/NUS Modules/Y2S2 Modules/EE2026/EE2026Project/Tank_Game/MODS.runs/impl_1/Top_Student_drc_routed.rpt.
report_drc completed successfully
INFO: [runtcl-4] Executing : report_methodology -file Top_Student_methodology_drc_routed.rpt -pb Top_Student_methodology_drc_routed.pb -rpx Top_Student_methodology_drc_routed.rpx
Command: report_methodology -file Top_Student_methodology_drc_routed.rpt -pb Top_Student_methodology_drc_routed.pb -rpx Top_Student_methodology_drc_routed.rpx
INFO: [Timing 38-35] Done setting XDC timing constraints.
INFO: [Timing 38-35] Done setting XDC timing constraints.
INFO: [DRC 23-133] Running Methodology with 2 threads
INFO: [Coretcl 2-1520] The results of Report Methodology are in file C:/Users/teode/OneDrive/Documents/NUS Modules/Y2S2 Modules/EE2026/EE2026Project/Tank_Game/MODS.runs/impl_1/Top_Student_methodology_drc_routed.rpt.
report_methodology completed successfully
INFO: [runtcl-4] Executing : report_power -file Top_Student_power_routed.rpt -pb Top_Student_power_summary_routed.pb -rpx Top_Student_power_routed.rpx
Command: report_power -file Top_Student_power_routed.rpt -pb Top_Student_power_summary_routed.pb -rpx Top_Student_power_routed.rpx
INFO: [Timing 38-35] Done setting XDC timing constraints.
Running Vector-less Activity Propagation...

Finished Running Vector-less Activity Propagation
76 Infos, 0 Warnings, 0 Critical Warnings and 0 Errors encountered.
report_power completed successfully
INFO: [runtcl-4] Executing : report_route_status -file Top_Student_route_status.rpt -pb Top_Student_route_status.pb
INFO: [runtcl-4] Executing : report_timing_summary -max_paths 10 -file Top_Student_timing_summary_routed.rpt -pb Top_Student_timing_summary_routed.pb -rpx Top_Student_timing_summary_routed.rpx -warn_on_violation 
INFO: [Timing 38-91] UpdateTimingParams: Speed grade: -1, Delay Type: min_max, Timing Stage: Requireds.
INFO: [Timing 38-191] Multithreading enabled for timing update using a maximum of 2 CPUs
INFO: [runtcl-4] Executing : report_incremental_reuse -file Top_Student_incremental_reuse_routed.rpt
INFO: [Vivado_Tcl 4-545] No incremental reuse to report, no incremental placement and routing data was found.
INFO: [runtcl-4] Executing : report_clock_utilization -file Top_Student_clock_utilization_routed.rpt
INFO: [runtcl-4] Executing : report_bus_skew -warn_on_violation -file Top_Student_bus_skew_routed.rpt -pb Top_Student_bus_skew_routed.pb -rpx Top_Student_bus_skew_routed.rpx
INFO: [Timing 38-91] UpdateTimingParams: Speed grade: -1, Delay Type: min_max, Timing Stage: Requireds.
INFO: [Timing 38-191] Multithreading enabled for timing update using a maximum of 2 CPUs
INFO: [Common 17-206] Exiting Vivado at Sat Mar 30 12:14:16 2024...

*** Running vivado
    with args -log Top_Student.vdi -applog -m64 -product Vivado -messageDb vivado.pb -mode batch -source Top_Student.tcl -notrace


****** Vivado v2018.2 (64-bit)
  **** SW Build 2258646 on Thu Jun 14 20:03:12 MDT 2018
  **** IP Build 2256618 on Thu Jun 14 22:10:49 MDT 2018
    ** Copyright 1986-2018 Xilinx, Inc. All Rights Reserved.

source Top_Student.tcl -notrace
Command: open_checkpoint Top_Student_routed.dcp

Starting open_checkpoint Task

Time (s): cpu = 00:00:00 ; elapsed = 00:00:00.041 . Memory (MB): peak = 231.262 ; gain = 0.000
INFO: [Netlist 29-17] Analyzing 270 Unisim elements for replacement
INFO: [Netlist 29-28] Unisim Transformation completed in 0 CPU seconds
INFO: [Project 1-479] Netlist was created with Vivado 2018.2
INFO: [Device 21-403] Loading part xc7a35tcpg236-1
INFO: [Project 1-570] Preparing netlist for logic optimization
INFO: [Timing 38-478] Restoring timing data from binary archive.
INFO: [Timing 38-479] Binary timing data restore complete.
INFO: [Project 1-856] Restoring constraints from binary archive.
INFO: [Project 1-853] Binary constraint restore complete.
Reading XDEF placement.
Reading placer database...
Reading XDEF routing.
Read XDEF File: Time (s): cpu = 00:00:00 ; elapsed = 00:00:00.363 . Memory (MB): peak = 1085.227 ; gain = 0.000
Restored from archive | CPU: 0.000000 secs | Memory: 0.000000 MB |
Finished XDEF File Restore: Time (s): cpu = 00:00:00 ; elapsed = 00:00:00.364 . Memory (MB): peak = 1085.227 ; gain = 0.000
INFO: [Project 1-111] Unisim Transformation Summary:
No Unisim elements were transformed.

INFO: [Project 1-604] Checkpoint was created with Vivado v2018.2 (64-bit) build 2258646
open_checkpoint: Time (s): cpu = 00:00:11 ; elapsed = 00:00:38 . Memory (MB): peak = 1085.227 ; gain = 862.434
Command: write_bitstream -force Top_Student.bit
Attempting to get a license for feature 'Implementation' and/or device 'xc7a35t'
INFO: [Common 17-349] Got license for feature 'Implementation' and/or device 'xc7a35t'
Running DRC as a precondition to command write_bitstream
INFO: [IP_Flow 19-234] Refreshing IP repositories
INFO: [IP_Flow 19-1704] No user IP repositories specified
INFO: [IP_Flow 19-2313] Loaded Vivado IP repository 'C:/Xilinx/Vivado/2018.2/data/ip'.
INFO: [DRC 23-27] Running DRC with 2 threads
INFO: [Vivado 12-3199] DRC finished with 0 Errors
INFO: [Vivado 12-3200] Please refer to the DRC report (report_drc) for more information.
INFO: [Designutils 20-2272] Running write_bitstream with 2 threads.
Loading data files...
Loading site data...
Loading route data...
Processing options...
Creating bitmap...
Creating bitstream...
Bitstream compression saved 14498208 bits.
Writing bitstream ./Top_Student.bit...
INFO: [Vivado 12-1842] Bitgen Completed Successfully.
INFO: [Project 1-120] WebTalk data collection is mandatory when using a WebPACK part without a full Vivado license. To see the specific WebTalk data collected for your design, open the usage_statistics_webtalk.html or usage_statistics_webtalk.xml file in the implementation directory.
INFO: [Common 17-83] Releasing license: Implementation
22 Infos, 0 Warnings, 0 Critical Warnings and 0 Errors encountered.
write_bitstream completed successfully
write_bitstream: Time (s): cpu = 00:00:06 ; elapsed = 00:00:18 . Memory (MB): peak = 1555.371 ; gain = 470.145
INFO: [Common 17-206] Exiting Vivado at Sat Mar 30 12:15:38 2024...
